{
  "$schema": "https://json-schema.org/draft/2020-12/schema",
  "title": "architecture_freeze",
  "type": "object",
  "required": [
    "task_id",
    "phase",
    "from_agent",
    "requested_by",
    "relevant_specs",
    "problem_statement",
    "boundary_decisions",
    "dependency_direction",
    "interface_freeze_points",
    "ownership_lifecycle_constraints",
    "nfr_constraints",
    "forbidden_shortcuts",
    "tradeoffs",
    "blueprint_refs",
    "supporting_evidence_refs",
    "supersedes_freeze_refs",
    "notes"
  ],
  "properties": {
    "task_id": {"type": "string", "minLength": 1},
    "phase": {"type": "string", "enum": ["contract_freeze"]},
    "from_agent": {"type": "string", "minLength": 1},
    "requested_by": {"type": "string", "minLength": 1},
    "relevant_specs": {"type": "array", "items": {"type": "string"}},
    "problem_statement": {"type": "string", "minLength": 1},
    "boundary_decisions": {"type": "array", "items": {"type": "string"}},
    "dependency_direction": {"type": "array", "items": {"type": "string"}},
    "interface_freeze_points": {"type": "array", "items": {"type": "string"}},
    "ownership_lifecycle_constraints": {"type": "array", "items": {"type": "string"}},
    "nfr_constraints": {"type": "array", "items": {"type": "string"}},
    "forbidden_shortcuts": {"type": "array", "items": {"type": "string"}},
    "tradeoffs": {"type": "array", "items": {"type": "string"}},
    "blueprint_refs": {"type": "array", "items": {"type": "string"}},
    "supporting_evidence_refs": {"type": "array", "items": {"type": "string"}},
    "supersedes_freeze_refs": {"type": "array", "items": {"type": "string"}},
    "notes": {"type": "string"}
  },
  "additionalProperties": true
}
